{
  "id": "breast-pull-out-focus",
  "nameKeys": {
    "enGB": "swim.drill.breast_pull_out_focus.name",
    "uk": "swim.drill.breast_pull_out_focus.name"
  },
  "strokeIds": [
    "breaststroke"
  ],
  "focus": [
    "pull",
    "timing"
  ],
  "level": "intermediate",
  "equipment": [
    "none"
  ],
  "technique": [
    "Practise a controlled outsweep–insweep without rushing the breath."
  ],
  "cues": [
    "Outsweep soft",
    "Insweep accelerate"
  ],
  "commonMistakes": [
    "Pulling past shoulders late"
  ],
  "evidenceRefs": [
    {
      "kind": "doi",
      "id": "10.1249/MSS.0b013e318213fefb",
      "label": "Garber et al. 2011 ACSM — quantity/quality of exercise",
      "supports": [
        "endurance",
        "technique",
        "safety"
      ]
    }
  ]
}
