{
  "id": "snorkel-freestyle-balance",
  "nameKeys": {
    "enGB": "swim.drill.snorkel_freestyle_balance.name",
    "uk": "swim.drill.snorkel_freestyle_balance.name"
  },
  "strokeIds": [
    "freestyle"
  ],
  "focus": [
    "balance",
    "catch"
  ],
  "level": "beginner",
  "equipment": [
    "snorkel"
  ],
  "technique": [
    "Use a centre snorkel to remove breathing disruption while refining alignment."
  ],
  "cues": [
    "Neutral neck",
    "Quiet kick"
  ],
  "commonMistakes": [
    "Looking forward too much"
  ],
  "evidenceRefs": [
    {
      "kind": "doi",
      "id": "10.1249/MSS.0b013e318213fefb",
      "label": "Garber et al. 2011 ACSM — quantity/quality of exercise",
      "supports": [
        "endurance",
        "technique",
        "safety"
      ]
    }
  ]
}
