{
  "id": "fingertip-drag-freestyle",
  "nameKeys": {
    "enGB": "swim.drill.fingertip_drag_freestyle.name",
    "uk": "swim.drill.fingertip_drag_freestyle.name"
  },
  "strokeIds": [
    "freestyle"
  ],
  "focus": [
    "recovery",
    "rotation"
  ],
  "level": "beginner",
  "equipment": [
    "none"
  ],
  "technique": [
    "Drag fingertips lightly along the surface on recovery to keep the elbow high."
  ],
  "cues": [
    "High elbow recovery",
    "Soft fingertips"
  ],
  "commonMistakes": [
    "Straight-arm recovery",
    "Dropped elbow"
  ],
  "evidenceRefs": [
    {
      "kind": "doi",
      "id": "10.1249/MSS.0b013e318213fefb",
      "label": "Garber et al. 2011 ACSM — quantity/quality of exercise",
      "supports": [
        "endurance",
        "technique",
        "safety"
      ]
    }
  ]
}
