{
  "id": "breast-two-kick-one-pull",
  "nameKeys": {
    "enGB": "swim.drill.breast_two_kick_one_pull.name",
    "uk": "swim.drill.breast_two_kick_one_pull.name"
  },
  "strokeIds": [
    "breaststroke"
  ],
  "focus": [
    "timing",
    "kick"
  ],
  "level": "intermediate",
  "equipment": [
    "none"
  ],
  "technique": [
    "Two kicks for each arm pull to reinforce timing and body line."
  ],
  "cues": [
    "Kick finishes forward",
    "Patient arms"
  ],
  "commonMistakes": [
    "Desynchronised breath"
  ],
  "evidenceRefs": [
    {
      "kind": "doi",
      "id": "10.1249/MSS.0b013e318213fefb",
      "label": "Garber et al. 2011 ACSM — quantity/quality of exercise",
      "supports": [
        "endurance",
        "technique",
        "safety"
      ]
    }
  ]
}
